{
  "name": "Example Voice Project",
  "project_type": "Application",
  "team_name": "Example Team",
  "event": "Community projects",
  "source_url": "https://github.com/example/example-voice-project",
  "article_url": null,
  "live_demo_url": null,
  "demo_video_url": null,
  "summary": "A voice application that shows what the project does and why it is useful.",
  "team_members": [
    {
      "name": "Example Builder",
      "linkedin": null,
      "github": "https://github.com/example"
    }
  ]
}
